{
  "$schema": "http://json-schema.org/draft-07/schema#",
  "title": "KOL Topic Affinity Schema (v3)",
  "description": "每個 KOL 的『可發揮屬性』與『時事話題連結點』。由 profile.json / character.md / content_style.md / kols/keywords.md 導出，供 Dashboard 計算人設與話題的 Match 分數。軸與領域詞彙見 kols/topic-axes.json。v2 由 v1 精簡而來（docs/10）：四軸取代八軸、拿掉 baseline_funnel 與逐 hook 的 affinity/axis_demand。v3 依 docs/11 補上三個 gate 與計分實際會讀、但 v2 沒有定義的欄位：credibility_mode（G2 的前提，缺了就擋在 validation 的 V2）、credibility_basis、homophily（三維計分的其中一維）、credibility_risk。這份檔案先前停留在 v2 而 repo 內所有資料早已是 v3——schema 落後於資料本身就是一種未被執行的規格，故一併校正。",
  "type": "object",
  "required": ["kol_id", "schema_version", "credibility_mode", "axes", "homophily", "pillar_keywords", "topic_hooks", "reach"],
  "additionalProperties": false,
  "properties": {
    "kol_id": { "type": "string", "description": "對應 kols/index.json 的 id" },
    "schema_version": { "const": 3 },
    "credibility_mode": {
      "type": "string",
      "enum": ["embodied", "hybrid", "database"],
      "description": "可信度型態。**這是 G2 gate 的前提，不可省略**（缺少時 dashboard 的 validation 會以 V2 擋下，不進計分）。embodied＝可信度來自親身經歷；database＝來自整理可查證資料；hybrid＝兩者兼有。注意：本 repo 所有人設都是 AI 生成，宣告 embodied／hybrid 等於留下一個帳號無法背書的長期主張，Dashboard 會標為需人工逐題覆核。"
    },
    "credibility_basis": {
      "type": "array",
      "description": "可信度的來源逐項拆開，並標明哪些可查證。把不可查證的那些寫出來，是為了讓它們在被寫進腳本前就先被看見。",
      "items": {
        "type": "object",
        "required": ["type", "desc", "verifiable"],
        "additionalProperties": false,
        "properties": {
          "type": { "type": "string", "description": "來源類型，例如 public_data / certification_claim / field_claim" },
          "desc": { "type": "string" },
          "verifiable": { "type": "boolean", "description": "第三方能否查證。AI 人設的第一人稱現場敘述一律 false。" }
        }
      }
    },
    "credibility_risk": {
      "type": "string",
      "description": "選填。這個人設在具身主張／不可能憑證上的最大風險，用白話寫出來。留白代表『沒有風險』，所以有風險就要寫。"
    },
    "homophily": {
      "type": "object",
      "description": "相似性。**Match 三維之一**（fit / pillar / homophily 等權），缺少或 why 過短則該維不計入平均。",
      "required": ["score", "why", "audience_identity", "shared_situation", "language_register"],
      "additionalProperties": false,
      "properties": {
        "score": { "type": "number", "minimum": 0, "maximum": 100 },
        "why": { "type": "string", "minLength": 10, "description": "這個分數從 profile.json 的哪一句推出來。沒有 why 的分數視為未定義。" },
        "audience_identity": { "type": "string", "description": "受眾是誰" },
        "shared_situation": { "type": "string", "description": "KOL 與受眾共同的處境" },
        "language_register": { "type": "string", "description": "說話的層級與方式" }
      }
    },
    "axes": {
      "type": "object",
      "description": "四軸屬性向量。鍵必須是 kols/topic-axes.json 的 axes[].key。",
      "required": ["analysis", "story", "visual", "credibility"],
      "additionalProperties": false,
      "properties": {
        "analysis": { "$ref": "#/definitions/axisScore" },
        "story": { "$ref": "#/definitions/axisScore" },
        "visual": { "$ref": "#/definitions/axisScore" },
        "credibility": { "$ref": "#/definitions/axisScore" }
      }
    },
    "format_fit": {
      "$ref": "#/definitions/axisScore",
      "description": "日常適配。**不參與 Match 計分**——它影響的是怎麼拍，不是選什麼題。供作業流程 (c) 的素材企劃判斷是否適合做成日常／隨手感切角。"
    },
    "material_attributes": {
      "type": "object",
      "description": "可執行性檢查需要的生成條件。視覺語言與色盤不放這裡——直接讀 profile.json 的 content.aesthetic。",
      "additionalProperties": false,
      "properties": {
        "generation_model": { "type": "string" },
        "consistency": { "type": "string" },
        "usable_formats": { "type": "array", "items": { "type": "string" } }
      }
    },
    "pillar_keywords": {
      "type": "object",
      "description": "內容支柱的比對關鍵字。鍵為 profile.json content.pillars[].name。支柱名稱與描述多為英文或繁體，話題多為簡體，僅靠原文比對會漏。**關鍵字要具體**——「判斷」「選擇」「故事」這類泛用詞會讓所有支柱都命中，等於沒有支柱。",
      "additionalProperties": { "type": "array", "items": { "type": "string" } }
    },
    "topic_hooks": {
      "type": "array",
      "minItems": 3,
      "maxItems": 8,
      "description": "3–5 個（最多 8）該 KOL 與網路時事／文化的固定連結點。不再自帶 affinity 分數——分數由引擎算。",
      "items": {
        "type": "object",
        "required": ["id", "domain", "title", "angle", "pillar", "keywords"],
        "additionalProperties": false,
        "properties": {
          "id": { "type": "string" },
          "domain": { "type": "string", "description": "kols/topic-axes.json 的 domains[].key" },
          "title": { "type": "string" },
          "angle": { "type": "string", "description": "這個 KOL 切入這個連結點的專屬角度" },
          "pillar": { "type": "string", "description": "對應 profile.json content.pillars 的支柱名稱" },
          "keywords": { "type": "array", "items": { "type": "string" }, "description": "用於與 Apify 抓回的 Tag 做交叉比對" },
          "evergreen": { "type": "boolean", "description": "true = 長青題材，false = 需搭當期時事" },
          "axis_demand": {
            "type": "object",
            "description": "選填，且**預設不要填**。只有當這個連結點的軸需求明顯偏離 domain 平均時才覆寫（例如同為 movie 但這題是純情緒故事）。",
            "additionalProperties": { "type": "number", "minimum": 0, "maximum": 100 }
          }
        }
      }
    },
    "redlines": {
      "type": "array",
      "description": "兩種嚴重度而已：block 擋下來，warn 標示出來。v1 的扣分算術（high −40 / medium −20）已移除——沒有人能說清楚那兩個數字的差別。",
      "items": {
        "type": "object",
        "required": ["rule", "keywords", "severity"],
        "additionalProperties": false,
        "properties": {
          "rule": { "type": "string", "description": "紅線描述（取自 profile content.brand_dont）" },
          "keywords": { "type": "array", "items": { "type": "string" }, "description": "命中即觸發的關鍵字" },
          "severity": {
            "type": "string",
            "enum": ["block", "warn"],
            "description": "block = 不進推薦清單，只出現在「已排除」；warn = 照常排序，但列出警告，不扣分"
          }
        }
      }
    },
    "reach": {
      "type": "object",
      "required": ["regions", "language"],
      "additionalProperties": false,
      "properties": {
        "regions": { "type": "array", "items": { "type": "string" }, "description": "主要覆蓋地區（topic-axes.json regions[].key），依相關性排序" },
        "language": { "type": "string", "description": "貼文語言（zh-Hans / zh-Hant / en …），依 docs/06 的簡繁對應規則" }
      }
    }
  },
  "definitions": {
    "axisScore": {
      "type": "object",
      "required": ["score", "why"],
      "additionalProperties": false,
      "properties": {
        "score": { "type": "number", "minimum": 0, "maximum": 100 },
        "why": {
          "type": "string",
          "minLength": 10,
          "description": "這個分數是從 profile.json 的哪一句推出來的。**沒有 why 的分數視為未定義，不可進入計算。**"
        }
      }
    }
  }
}
