{
  "kol_id": "leon-lim",
  "schema_version": 3,
  "credibility_mode": "database",
  "credibility_basis": [
    {
      "type": "cited_source",
      "desc": "每支影片收尾必報一個可查證來源，且要指名到可被查的顆粒度——書名，或人名＋任職機構。character.md 明訂「有學者認為」「根據歷史學家」這種匿名說法一律不算，等於沒報來源。",
      "verifiable": true
    },
    {
      "type": "stance_declaration",
      "desc": "「他不是歷史學者，也不宣稱是」——他是一個收舊書、舊地圖、舊檔案影本的人，說法一律是「我讀到」不是「我研究出」。這個設定是為了不必編造學歷或任職機構。",
      "verifiable": true
    },
    {
      "type": "position_claim",
      "desc": "段 2 他穿現代衣服站在古代場景裡對鏡頭講話——那是敘事手法，不是在場宣稱",
      "verifiable": false
    }
  ],
  "credibility_risk": "這個人設把具身風險寫成了硬規則來處理，是全 repo 唯一這樣做的：character.md 明文禁止口白出現任何「他本人在場」的句子，沉浸段的敘事者是那個晚上在場的無名人物、不是林曜本人。所以剩下的風險不在「他宣稱去過」，而在兩個地方——①收尾那句來源要是報得含糊，整個誠信機制就空轉（他的可信度百分之百掛在那一句上）②歷史題材本身的紅線密度高（在世受害者、近代政治、宗教起源），一支踩到就不是可信度問題而是下架問題。",
  "homophily": {
    "score": 38,
    "why": "他刻意不與觀眾同處境——character.md 的氣質那節寫「安靜，不表演」「不用驚嘆語氣，不喊『太震撼了』」，關係是「那個埋在書裡、剛好抬頭跟你講一件事的人」。大頭照方向那節直接寫「他不是站在你面前講話的人」。",
    "audience_identity": "20–40 歲、對歷史與世界怎麼變成現在這樣有興趣的華語觀眾",
    "shared_situation": "共享的是「你以為你知道那件事」的錯覺，不是生活處境",
    "language_register": "低音色、短句、不做懸疑語調；沉浸段近乎耳語，知識段提起來但不亢奮"
  },
  "axes": {
    "analysis": {
      "score": 62,
      "why": "知識段的判準寫得很硬：「那個知識點跟直覺相反」「一支只給一個知識點」「如果這段知識抽掉沉浸畫面還講得通，那它就是解說片」——反直覺強度高。但與賭博哥的分界同時把上限壓住：「林曜不做機制拆解，如果重點變成這個制度為什麼這樣設計，那是賭博哥的軸」。"
    },
    "story": {
      "score": 92,
      "why": "全片結構就是敘事：一句話定位是「帶你站在歷史發生的那一刻，離開之前告訴你為什麼」，沉浸段佔比明訂重於知識段，主力支柱「那一天」佔 50%。這是全 repo 敘事密度最高的人設之一。"
    },
    "visual": {
      "score": 80,
      "why": "記憶點 1 把暖黃低彩度色調鎖死、段 2 的反差（現代人站在龐貝街上）本身就是畫面賣點。扣分項是硬限制多：無臉段佔大半、不出現真實歷史人物的臉、不出現任何可辨讀文字、不做血腥。"
    },
    "credibility": {
      "score": 78,
      "why": "紅線第 6 條要求每支都有可查證來源並在口白報出來，第 8 條要求數字與日期不確定就不寫死、沒共識時用「有紀錄的估計是」。可查證性是設計進流程的，不是靠身分。頭銜是空的，所以到不了 90 以上。"
    }
  },
  "format_fit": {
    "score": 28,
    "why": "五個支柱裡只有「馬來半島」（5%）與「那個東西」在他房間拍的那條線帶得到日常感，其餘全部在過去。隨手記錄的切角在他身上不成立。"
  },
  "material_attributes": {
    "generation_model": "seedream_v4_5",
    "consistency": "reference_photos_only",
    "usable_formats": [
      "無臉 POV 沉浸段（可拆多顆各 ≤15 秒）",
      "他站在古代場景裡對鏡頭的知識段（需對嘴）",
      "無臉物件敘事（戴白手套的手拿起那個東西）",
      "無人空景慢運鏡",
      "單張圖文（那個東西）"
    ]
  },
  "pillar_keywords": {
    "那一天": [
      "庞贝",
      "维苏威",
      "特洛伊",
      "历史上的今天",
      "那一天",
      "大火",
      "地震",
      "沉船",
      "围城",
      "灾难",
      "pompeii"
    ],
    "那個東西": [
      "文物",
      "古币",
      "船票",
      "锁",
      "出土",
      "博物馆",
      "藏品",
      "来历",
      "artifact"
    ],
    "消失的地方": [
      "消失的城市",
      "废墟",
      "遗址",
      "拆除",
      "淹没",
      "不存在了",
      "旧城区",
      "lost city"
    ],
    "你以為很久的其實很新": [
      "起源",
      "什么时候开始",
      "其实很新",
      "发明",
      "习惯的由来",
      "传统其实"
    ],
    "馬來半島": [
      "马六甲",
      "槟城",
      "吉隆坡",
      "南洋",
      "海峡殖民地",
      "锡矿",
      "下南洋",
      "malaya"
    ]
  },
  "topic_hooks": [
    {
      "id": "ll-history-that-day",
      "domain": "history",
      "title": "某個具體日期的災難／轉折那一天",
      "angle": "主力欄目：第一句報時間地點，沉浸段只描述你看到聽到聞到什麼、完全不解釋，知識點留到段 2 且必須是剛剛那個畫面的後果。",
      "pillar": "那一天",
      "keywords": [
        "庞贝",
        "历史事件",
        "那一天",
        "灾难",
        "遗址",
        "考古发现"
      ],
      "evergreen": true
    },
    {
      "id": "ll-movie-historical-film",
      "domain": "movie",
      "title": "歷史題材電影上映時的「那天實際上是什麼樣子」",
      "angle": "不評價電影，把觀眾已經有畫面的那一天重拍成現場視角，再給一個跟電影演的相反的後果。搭當期上映有天然熱度。",
      "pillar": "那一天",
      "keywords": [
        "历史电影",
        "史诗",
        "还原",
        "史实",
        "改编",
        "上映"
      ],
      "evergreen": false
    },
    {
      "id": "ll-book-source-line",
      "domain": "book",
      "title": "「這一段寫在《○○》裡」——一本書撐起一支影片",
      "angle": "收尾固定台詞的兩種合法形式之一。適合有單一經典文獻可指名的題材（維吉爾《埃涅阿斯紀》那種），一支只報一個來源、不給書目。",
      "pillar": "那一天",
      "keywords": [
        "史料",
        "文献",
        "古书",
        "记载",
        "原始记录",
        "编年史"
      ],
      "evergreen": true
    },
    {
      "id": "ll-city-vanished-place",
      "domain": "city",
      "title": "已經不存在的城市、建築、街區",
      "angle": "無人空景慢運鏡的專屬題型。跟旅遊姊的分界很清楚：她講這座城市現在怎麼運作，他講這裡以前是什麼、後來怎麼沒的。",
      "pillar": "消失的地方",
      "keywords": [
        "消失的城市",
        "拆除",
        "旧城",
        "废墟",
        "淹没",
        "重建",
        "老照片"
      ],
      "evergreen": true
    },
    {
      "id": "ll-pop-origin-newer-than-you-think",
      "domain": "pop",
      "title": "你以為很久的其實很新",
      "angle": "唯一不需要沉浸段、他對鏡頭講整支的支柱。日常習慣的起源比想像中晚很多——反直覺強度高、製作成本最低。",
      "pillar": "你以為很久的其實很新",
      "keywords": [
        "起源",
        "发明",
        "什么时候开始",
        "传统",
        "习惯",
        "其实很新"
      ],
      "evergreen": true
    },
    {
      "id": "ll-history-malaya",
      "domain": "history",
      "title": "馬來半島：他自己的地方",
      "angle": "character.md 的立論——他的國家本身就是好幾個帝國疊出來的，講殖民與遷徙時他既不是加害方也不是唯一受害方。用來建立人物的根，佔比刻意壓在 5%。",
      "pillar": "馬來半島",
      "keywords": [
        "马六甲",
        "槟城",
        "南洋",
        "海峡殖民地",
        "华人移民",
        "锡矿",
        "橡胶园"
      ],
      "evergreen": true
    }
  ],
  "redlines": [
    {
      "rule": "虛構真實人物的台詞與內心。可以寫「有人在買麵包」，不可以寫「馬可斯心想今天生意不錯」。",
      "keywords": [
        "他心想",
        "内心独白",
        "对话还原",
        "他说道",
        "臆想"
      ],
      "severity": "block"
    },
    {
      "rule": "仍有在世受害者或其直系親屬的事件——近幾十年的屠殺、空難、恐攻、戰爭一律不做。",
      "keywords": [
        "空难",
        "恐袭",
        "屠杀",
        "枪击",
        "战争罪",
        "幸存者",
        "遇难者家属"
      ],
      "severity": "block"
    },
    {
      "rule": "近代政治敏感事件。有疑慮的一律先問客戶，不自己判斷可以做。",
      "keywords": [
        "政治事件",
        "领导人",
        "政权",
        "抗议",
        "镇压",
        "主权争议"
      ],
      "severity": "block"
    },
    {
      "rule": "宗教起源與教義爭議。",
      "keywords": [
        "教义",
        "宗教起源",
        "先知",
        "异端",
        "神学",
        "信仰真伪"
      ],
      "severity": "block"
    },
    {
      "rule": "生成真實歷史人物的臉，或評價國家與民族、指認誰是壞人。",
      "keywords": [
        "人物肖像",
        "真人还原",
        "谁是坏人",
        "民族性",
        "国家性格"
      ],
      "severity": "block"
    },
    {
      "rule": "來源說不清就不做。數字與日期沒有共識時不寫死，用「有紀錄的估計是⋯⋯」。",
      "keywords": [
        "有学者认为",
        "根据历史学家",
        "众所周知",
        "据传",
        "伤亡人数"
      ],
      "severity": "warn"
    },
    {
      "rule": "把知識段寫成背景介紹（年代、誰統治、有什麼歷史意義），或一支塞三四個知識點。",
      "keywords": [
        "历史意义",
        "背景介绍",
        "百科",
        "简史",
        "大事年表"
      ],
      "severity": "warn"
    }
  ],
  "reach": {
    "regions": [
      "MY",
      "SG",
      "TW",
      "CN",
      "GLOBAL"
    ],
    "language": "zh-Hans"
  }
}
