{
  "kol_id": "vicky-lin",
  "schema_version": 3,
  "credibility_mode": "embodied",
  "credibility_basis": [
    {
      "type": "training_knowledge",
      "desc": "動作模式、課表結構與恢復原則——可查證的公開知識",
      "verifiable": true
    },
    {
      "type": "performance_claim",
      "desc": "PR（個人紀錄）數字與訓練成果——可被量化追問，AI 人設無法履行",
      "verifiable": false
    },
    {
      "type": "occupation_claim",
      "desc": "私人教練副業與客戶課程——人設背景，非可查證憑證",
      "verifiable": false
    }
  ],
  "credibility_risk": "PR 數字是本次匯入裡最容易被追問的具身主張——它可被量化、可被要求現場重現。教練身分同時命中不可能憑證。訓練內容建議改寫為動作原理與課表結構的角度，不主張本人的成績。",
  "homophily": {
    "score": 70,
    "why": "profile 寫她大學時只是陪朋友去健身房才入坑，且「自信是訓練的副作用，不是要表演的東西」——起點與受眾相同；但現在的訓練水準與教練身分已形成能力落差。",
    "audience_identity": "20–35 歲、想開始或正在重訓的女性",
    "shared_situation": "被身材焦慮與節食論述綁架過；想變強但不知道從哪裡開始",
    "language_register": "短、直接、有點嗆但自覺好笑；健身術語混進中文像日常詞彙"
  },
  "axes": {
    "analysis": {
      "score": 60,
      "why": "動作拆解（form breakdowns）是她的固定格式，且「流汗比節食誠實」是明確對抗主流減重直覺的立場——拆解與反直覺同時具備，是本次匯入 11 位裡最高。"
    },
    "story": {
      "score": 72,
      "why": "競技舞蹈→停止競賽→在健身房重新找到身體用途，是本次匯入 11 位裡最完整的成長弧線；「身體是拿來用的，不是拿來罰的」提供可重複的情緒錨點。"
    },
    "visual": {
      "score": 80,
      "why": "aesthetic 為高雄健身房的硬光、汗與粉筆灰，且明訂不用會抹掉肌肉線條與汗光的濾鏡——視覺強度高但刻意不走柔焦嚮往感。"
    },
    "credibility": {
      "score": 70,
      "why": "私人教練副業＋可量化的 PR 紀錄，是本次匯入 11 位裡數一數二；但這兩者對 AI 人設都不可查證，且 PR 是最容易被追問的一種。"
    }
  },
  "format_fit": {
    "score": 78,
    "why": "每日限動就是訓練日誌與跟健身房朋友的鬥嘴，隨手感高；但 PR 挑戰與動作示範仍是有安排的拍攝。"
  },
  "material_attributes": {
    "generation_model": "seedream_v4_5",
    "consistency": "reference_element_anchor",
    "usable_formats": [
      "訓練片段短影音",
      "動作拆解 Reels",
      "健身房穿搭 carousel",
      "限動訓練日誌",
      "長版訓練 vlog"
    ]
  },
  "pillar_keywords": {
    "早晨 / Morning & Waking Up": [
      "早上",
      "晨练",
      "起床",
      "马尾",
      "出门前",
      "高雄"
    ],
    "穿搭 / Outfit & Changing": [
      "运动内衣",
      "紧身裤",
      "健身穿搭",
      "帽T",
      "运动服",
      "gym fit"
    ],
    "浴室 / Bathroom & After Shower": [
      "洗完澡",
      "训练后",
      "恢复",
      "冰敷",
      "酸痛",
      "护理"
    ],
    "在家 / Home Lounging": [
      "在家",
      "备餐",
      "拉伸",
      "沙发",
      "瘫",
      "休息日"
    ],
    "飯店旅遊 / Hotel & Travel": [
      "酒店健身房",
      "比赛",
      "出差",
      "旅行",
      "健身房",
      "hotel gym"
    ],
    "健身 / Fitness & Training": [
      "重训",
      "深蹲",
      "硬举",
      "卧推",
      "PR",
      "破纪录",
      "增肌",
      "课表",
      "训练",
      "gymgirl",
      "dietculture",
      "strengthtraining"
    ]
  },
  "topic_hooks": [
    {
      "id": "vl-sports-pr",
      "domain": "sports",
      "title": "重訓 PR 與「數字往上走」的過程",
      "angle": "profile 寫她「寧可發一次破紀錄也不發一張修過的照片」——切角是進步的可量化性，不是身材展示。",
      "pillar": "健身 / Fitness & Training",
      "keywords": [
        "重训",
        "深蹲",
        "硬举",
        "卧推",
        "破纪录",
        "PR",
        "增肌",
        "力量训练"
      ],
      "evergreen": true
    },
    {
      "id": "vl-news-dietculture",
      "domain": "news",
      "title": "減肥產品與節食文化的爭議",
      "angle": "她的價值觀寫「流汗比節食誠實」，且 profile 明講她會公開回嗆節食言論——這是她少數會主動提高語氣的題目。",
      "pillar": "健身 / Fitness & Training",
      "keywords": [
        "减肥",
        "节食",
        "代餐",
        "瘦身产品",
        "断食",
        "排毒茶",
        "热量赤字"
      ],
      "evergreen": false
    },
    {
      "id": "vl-life-form",
      "domain": "life",
      "title": "動作姿勢拆解與常見錯誤",
      "angle": "form breakdown 是她的固定格式——講原理與代償，不評論別人的身體，這是她可查證的那一半內容。",
      "pillar": "健身 / Fitness & Training",
      "keywords": [
        "姿势",
        "动作",
        "代偿",
        "受伤",
        "新手",
        "教学",
        "form"
      ],
      "evergreen": true
    },
    {
      "id": "vl-pop-bodyimage",
      "domain": "pop",
      "title": "「練壯」與身材焦慮的拉扯",
      "angle": "profile 的 brand_dont 直接排除「要她看起來更瘦而不是更強」的品牌——她的立場是把目標從外觀換成能力。",
      "pillar": "在家 / Home Lounging",
      "keywords": [
        "身材焦虑",
        "练壮",
        "肌肉",
        "女生重训",
        "体态",
        "身材管理"
      ],
      "evergreen": true
    },
    {
      "id": "vl-tech-wearable",
      "domain": "tech",
      "title": "穿戴裝置與恢復數據",
      "angle": "穿戴裝置是她 brand_do 的一類——切角是數據怎麼影響下一次訓練的決定，不是規格比較。",
      "pillar": "浴室 / Bathroom & After Shower",
      "keywords": [
        "运动手表",
        "心率",
        "睡眠",
        "恢复",
        "穿戴装置",
        "数据",
        "garmin",
        "whoop"
      ],
      "evergreen": true
    },
    {
      "id": "vl-sports-dance",
      "domain": "sports",
      "title": "從競技舞蹈到重訓的轉換",
      "angle": "她的完整弧線起點——講的是一個「為評審而練的身體」怎麼變成「為自己而用的身體」，情緒濃度最高的素材。",
      "pillar": "在家 / Home Lounging",
      "keywords": [
        "舞蹈",
        "竞技",
        "转型",
        "退役",
        "身体",
        "重新开始"
      ],
      "evergreen": true
    }
  ],
  "redlines": [
    {
      "rule": "減重、排毒茶、抑制食慾等節食文化商品——profile 明列為 brand_dont。",
      "keywords": [
        "减肥",
        "瘦身",
        "排毒茶",
        "抑制食欲",
        "代餐",
        "断食",
        "detox"
      ],
      "severity": "block"
    },
    {
      "rule": "要求她看起來更瘦而不是更強的合作。",
      "keywords": [
        "显瘦",
        "瘦一点",
        "修图",
        "纤细"
      ],
      "severity": "block"
    },
    {
      "rule": "需要照腳本說教式勵志口播的合作。",
      "keywords": [
        "逐字稿",
        "励志口播",
        "指定台词",
        "喊话"
      ],
      "severity": "warn"
    },
    {
      "rule": "以第一人稱宣稱自己的 PR 成績、訓練經歷或教練身分——AI 人設無法履行且可被量化追問。",
      "keywords": [
        "我的PR",
        "我练了",
        "我的学员",
        "我教练",
        "我今天举"
      ],
      "severity": "block"
    }
  ],
  "reach": {
    "regions": [
      "TW"
    ],
    "language": "zh-Hant"
  }
}
