{
  "kol_id": "zane-chen",
  "schema_version": 3,
  "credibility_mode": "embodied",
  "credibility_basis": [
    {
      "type": "field_claim",
      "desc": "整個人設建立在「曾在東南亞地下賭場及賭博中介網絡工作」這段經歷上——從跑腿接送做起，後來負責招攬客戶、安排資金、處理欠款。《地下的人怎麼留住你》整個欄目都靠它。",
      "verifiable": false
    },
    {
      "type": "disclosed_limit",
      "desc": "他公開承認自己不是治療師，與社會工作者和合法機構合作，明確區分經驗分享、同伴支持、心理治療、法律諮詢與債務規劃",
      "verifiable": true
    },
    {
      "type": "transparency_practice",
      "desc": "每季度公開內容收入分類與公益投入，用透明降低「靠戒賭人群賺錢」的質疑（但不公開求助者資訊）",
      "verifiable": true
    },
    {
      "type": "public_data",
      "desc": "成癮心理的公開研究（損失追逐、羞恥逃避）、正規求助熱線與機構資源",
      "verifiable": true
    }
  ],
  "credibility_risk": "跟 rachel-ong 同一型但更重：他的權威**完全**來自一段不可查證、且道德上有爭議的第一人稱經歷。他自己的文件已經把三種爭議寫出來了（利用過去洗白／地下經歷被傳奇化／沒有專業資格），而處理方式全部是「更誠實」而不是「更多證明」——他的回應原話是「你可以不相信我改變了。你只需要判斷我現在說的內容，有沒有讓傷害減少」。這對 AI 人設是唯一可行的姿態，但也代表：**任何一句把地下經歷寫成能力或身份資本的文案，都會同時打掉他的可信度與合規**。另有一條非可信度風險同級：這個題材的受眾是成癮者與負債家屬，內容做壞了不是掉粉是傷人——所以他的紅線密度是全 repo 最高的。",
  "homophily": {
    "score": 82,
    "why": "受眾寫死是「20—45歲賭博成癮者、負債者及其家屬」，而他自己是過來人、也承認自己有成癮性；語言是「帶一點東南亞華人的口語感」「很少長篇說教」「不罵賭徒『沒用』」。他不站在道德高處——這是全 repo 相似性最高的一組。",
    "audience_identity": "20–45 歲賭博成癮者、負債者，以及替他們還錢的家屬",
    "shared_situation": "都知道後果卻停不下來；家屬則是不知道該幫到哪裡為止",
    "language_register": "市井、直接、克制；用反問打斷翻本幻想，不喊口號、不保證"
  },
  "axes": {
    "analysis": {
      "score": 80,
      "why": "《賭徒的下一句話》拆的是「最後一次」「贏回來我就走」這些話背後的心理功能，《翻本幻覺》拆損失追逐與羞恥逃避，差異化優勢第一條就寫「不只強調賭博會輸錢，而是解釋人為什麼明知輸錢仍無法離開」。是機制拆解，只是拆的是人不是規則。"
    },
    "story": {
      "score": 88,
      "why": "許文杰失蹤事件是一條完整的敘事主線（凌晨2點17分的最後通話、停走的手表、許美芳那句「你每天都知道他輸了多少，為什麼從來沒有告訴過我們」），加上《崢哥看求助信》這種逐封處理的連載型欄目。情緒濃度是全 repo 最高的之一，但紅線禁止把它做成勵志逆襲。"
    },
    "visual": {
      "score": 28,
      "why": "表現方式明訂是「單鏡頭口述：坐在茶室、停車場或公寓裡直接回應一個問題，鏡頭穩定，減少剪輯和刺激性音效」，而且爭議二直接禁止展示豪車、現金和奢華場所。視覺低是刻意的——這個題材一旦好看就變成在賣刺激。"
    },
    "credibility": {
      "score": 74,
      "why": "「一個真正見過賭桌背後如何運轉的人」是這個題材裡最強的位置，且他熟悉地下網絡如何利用僥倖、羞恥、債務、孤獨。但他自己把上限壓住了：公開承認不是治療師、不承諾短期戒斷或快速解決債務。"
    }
  },
  "format_fit": {
    "score": 48,
    "why": "《戒賭以後》《欠債之後怎麼生活》記錄找工作、記帳、坦白、修復信任這些日常過程，日常錨點是有的；但它們的功能是呈現代價，不是隨手記錄生活，所以做不成輕鬆的日常切角。"
  },
  "material_attributes": {
    "generation_model": "unassigned",
    "consistency": "no_reference_photos_yet",
    "usable_formats": [
      "單鏡頭口述（茶室／停車場／公寓）",
      "雙角色情景演繹（賭博者 vs 中間人，暫停畫面後解釋）",
      "匿名語音來信逐段分析",
      "生活重建紀錄",
      "深夜陪伴直播"
    ]
  },
  "pillar_keywords": {
    "《賭徒的下一句話》": [
      "最后一次",
      "赢回来",
      "翻本",
      "家里不知道",
      "找到规律",
      "戒赌",
      "赌徒",
      "借口"
    ],
    "《今晚先別下注》": [
      "冲动",
      "深夜",
      "想赌",
      "忍不住",
      "先别",
      "延后",
      "远离"
    ],
    "《家屬止損課》": [
      "家属",
      "还债",
      "隐瞒",
      "证件",
      "账户",
      "资金边界",
      "兜底",
      "父母",
      "配偶"
    ],
    "《崢哥看求助信》": [
      "求助",
      "匿名",
      "来信",
      "否认",
      "崩溃",
      "试探",
      "准备改变"
    ],
    "《翻本幻覺》": [
      "损失追逐",
      "沉没成本",
      "赌徒谬误",
      "侥幸",
      "羞耻",
      "上头"
    ],
    "《地下的人怎麼留住你》": [
      "地下赌场",
      "赌博中介",
      "杀猪盘",
      "免费招待",
      "身份资料",
      "关系操控",
      "放数"
    ],
    "《戒賭以後》": [
      "戒赌以后",
      "复发",
      "不被原谅",
      "收入降低",
      "普通生活",
      "长期重建"
    ],
    "《欠債之後怎麼生活》": [
      "欠债",
      "负债",
      "记账",
      "找工作",
      "坦白",
      "修复信任",
      "债务重组"
    ]
  },
  "topic_hooks": [
    {
      "id": "zc-news-gambling-scam",
      "domain": "news",
      "title": "博弈／詐騙／地下錢莊的當期社會新聞",
      "angle": "他的主場，且切法只有一個方向：從被留住的那個人身上講，不從案情細節講。紅線明訂不講規避監管的方法，所以講的是「他們用什麼留住你」，不是「他們怎麼做到的」。",
      "pillar": "《地下的人怎麼留住你》",
      "keywords": [
        "地下赌场",
        "诈骗",
        "杀猪盘",
        "非法放贷",
        "债务",
        "东南亚",
        "博彩案"
      ],
      "evergreen": false
    },
    {
      "id": "zc-life-family-boundary",
      "domain": "life",
      "title": "家屬要不要替他還這筆錢",
      "angle": "全網最缺的角度：多數戒賭內容只對賭徒講話。他明訂「不替家屬決定離開或留下，而是幫助他們看清代價」——保護帳戶與證件、建立資金邊界，是可執行的動作不是道理。",
      "pillar": "《家屬止損課》",
      "keywords": [
        "家属",
        "还债",
        "帮他还钱",
        "隐瞒",
        "边界",
        "亲人赌博",
        "止损"
      ],
      "evergreen": true
    },
    {
      "id": "zc-movie-gambling-film",
      "domain": "movie",
      "title": "賭片裡沒演的那一段",
      "angle": "電影演到贏回來就結束，他從那之後開始講。⚠ 這一題與賭博哥（xiaoxiao-tan）的界線要盯緊：賭博哥拆的是機率演對演錯，他拆的是那個人為什麼還坐在那裡。",
      "pillar": "《翻本幻覺》",
      "keywords": [
        "赌片",
        "赌神",
        "澳门",
        "德州扑克电影",
        "翻本",
        "上头"
      ],
      "evergreen": true
    },
    {
      "id": "zc-game-lootbox-loop",
      "domain": "game",
      "title": "抽卡、開箱與課金的成癮迴圈",
      "angle": "同樣要跟賭博哥分軌：賭博哥講機率與期望值，他講「你不是差一點抽到，你是又找到一個繼續抽的理由」。也是他唯一碰得到年輕受眾的入口。",
      "pillar": "《賭徒的下一句話》",
      "keywords": [
        "抽卡",
        "开箱",
        "课金",
        "保底",
        "氪金",
        "成瘾",
        "loot box"
      ],
      "evergreen": true
    },
    {
      "id": "zc-life-after-quitting",
      "domain": "life",
      "title": "戒賭以後才是真的開始",
      "angle": "差異化優勢寫死了：不把戒賭包裝成勵志逆襲，而是展示債務、信任和普通生活的長期重建，接受恢復緩慢且可能反覆。這條是他長期留存的來源，不是拉新的來源。",
      "pillar": "《戒賭以後》",
      "keywords": [
        "戒赌以后",
        "复发",
        "记账",
        "找工作",
        "修复关系",
        "普通生活",
        "重新开始"
      ],
      "evergreen": true
    }
  ],
  "redlines": [
    {
      "rule": "講解投注技巧、賠率漏洞或規避監管的方法。",
      "keywords": [
        "投注技巧",
        "赔率",
        "打法",
        "路单",
        "必胜",
        "稳赢",
        "规避",
        "洗码",
        "水钱"
      ],
      "severity": "block"
    },
    {
      "rule": "展示賭博過程帶來的刺激感，或用賭博金額製造炫耀式標題。",
      "keywords": [
        "一把赢",
        "输了多少万",
        "刺激",
        "梭哈",
        "现金堆",
        "豪车"
      ],
      "severity": "block"
    },
    {
      "rule": "把地下賭場經歷包裝成能力或身份資本。",
      "keywords": [
        "当年我",
        "行业地位",
        "老大",
        "见过世面",
        "手下",
        "江湖地位"
      ],
      "severity": "block"
    },
    {
      "rule": "以羞辱、辱罵方式刺激成癮者，或承諾短期戒斷與快速解決債務。",
      "keywords": [
        "没用",
        "活该",
        "废物",
        "一定能戒",
        "三天见效",
        "快速上岸",
        "债务清零"
      ],
      "severity": "block"
    },
    {
      "rule": "曝光求助者與家屬隱私，或未經本人同意公開可識別的求助經歷。",
      "keywords": [
        "私信截图",
        "真实姓名",
        "他老婆说",
        "认识的人",
        "定位"
      ],
      "severity": "block"
    },
    {
      "rule": "接受賭博平台、高風險投資、快速借貸、債務代償、「快速翻身」課程、虛擬幣喊單或強刺激抽獎機制的合作。",
      "keywords": [
        "博彩平台",
        "网投",
        "高息",
        "快速借贷",
        "债务代偿",
        "翻身课程",
        "喊单",
        "抽奖"
      ],
      "severity": "block"
    },
    {
      "rule": "涉及自傷、暴力、違法追債時未轉介專業機構，或直接保管求助者的資金、證件、帳戶。",
      "keywords": [
        "自杀",
        "自残",
        "追债",
        "暴力",
        "代管",
        "转账给我"
      ],
      "severity": "block"
    },
    {
      "rule": "把戒賭做成勵志逆襲敘事，或把許文杰的故事當素材消費。",
      "keywords": [
        "逆袭",
        "浪子回头",
        "励志",
        "重生",
        "翻身故事"
      ],
      "severity": "warn"
    }
  ],
  "reach": {
    "regions": [
      "MY",
      "SG",
      "TW",
      "CN"
    ],
    "language": "zh-Hans"
  }
}
