{
  "kol_id": "rachel-ong",
  "schema_version": 3,
  "credibility_mode": "embodied",
  "credibility_basis": [
    {
      "type": "public_data",
      "desc": "路線紀錄、事故報告、天氣與雪崩公告",
      "verifiable": true
    },
    {
      "type": "certification_claim",
      "desc": "IFMGA/UIAGM 認證嚮導——AI 在結構上不可能取得，且可被查名冊",
      "verifiable": false
    },
    {
      "type": "field_claim",
      "desc": "「我走過這條路線」「那晚我手指凍到沒感覺」等第一人稱現場敘述",
      "verifiable": false
    }
  ],
  "homophily": {
    "score": 45,
    "why": "受眾是有戶外興趣的都市工作者，但她是職業嚮導——能力與生活型態的落差很大。她的可親近感來自「承認自己也會怕」，不是來自相似的生活。",
    "audience_identity": "30–45 歲、在都市工作、有戶外興趣但不是專業者",
    "shared_situation": "時間破碎、想離開又不敢離開現在的位置；把「放棄」看得比「失敗」還重",
    "language_register": "口語但不裝熟；講判斷不講口號"
  },
  "credibility_risk": "這是全 repo 具身風險最高的人設。credibility 軸的 why 直接寫「IFMGA/UIAGM 國際認證嚮導」，命中 R-CREDENTIAL——而那是一個 AI 不可能取得、且可被查證的憑證。",
  "axes": {
    "analysis": {
      "score": 74,
      "why": "決策風格重度依賴檢查表與風險計算；「轉身不是失敗」直接對抗主流征服敘事，反直覺強度高但語氣不衝突。"
    },
    "story": {
      "score": 89,
      "why": "轉身時刻（30%）＋山徑日誌（25%）都是敘事型欄目，有真實事故作為弧線錨點；深夜筆記本是全 repo 情緒濃度最高的素材。"
    },
    "visual": {
      "score": 94,
      "why": "高海拔地景、暴風光、帳篷內頭燈——documentary-realist 視覺本身即內容；極限地景是最強嚮往感來源，但 brand_dont 禁止把危險演出來換取嚮往。"
    },
    "credibility": {
      "score": 95,
      "why": "IFMGA/UIAGM 國際認證嚮導，權威等級為全 repo 最高。"
    }
  },
  "format_fit": {
    "score": 50,
    "why": "非攀登季新加坡日常有素材，但比例低（設計上刻意節制）。"
  },
  "material_attributes": {
    "generation_model": "seedream_v4_5",
    "consistency": "reference_photos_only",
    "usable_formats": [
      "短影音案例口白",
      "紀錄片式長片段",
      "慢節奏獨白／旁白",
      "圖文 carousel 長文案"
    ]
  },
  "pillar_keywords": {
    "轉身時刻 Turning-Back Moments": [
      "转身",
      "下撤",
      "放弃",
      "止损",
      "关门时间",
      "登山",
      "事故",
      "撤退",
      "turn back",
      "retreat",
      "risk",
      "accident"
    ],
    "山徑日誌 Trail Journal": [
      "山径",
      "登山",
      "远征",
      "天气窗口",
      "路线",
      "营地",
      "装备",
      "日志",
      "高海拔",
      "珠峰",
      "expedition",
      "trail",
      "route",
      "gear",
      "altitude"
    ],
    "給平地人的山間道理 Mountain Wisdom for Flatlanders": [
      "高山症",
      "绳队",
      "锚点",
      "career",
      "boundary"
    ],
    "深夜筆記本 & 山下的人 Midnight Notebook / People off the Mountain": [
      "深夜",
      "笔记",
      "疲惫",
      "自我怀疑",
      "家人",
      "独白",
      "midnight",
      "notebook"
    ]
  },
  "topic_hooks": [
    {
      "id": "ro-history-1996",
      "domain": "history",
      "title": "1996 聖母峰山難與《Into Thin Air》",
      "angle": "以嚮導的職業視角重讀那天的決策鏈：哪幾個時間點還能轉身、為什麼沒有——她講的是判斷，不是災難本身。",
      "pillar": "山徑日誌 Trail Journal",
      "keywords": [
        "1996珠峰山难",
        "into thin air",
        "登山事故",
        "决策失误",
        "关门时间",
        "向导"
      ],
      "evergreen": true
    },
    {
      "id": "ro-movie-freesolo",
      "domain": "movie",
      "title": "《Free Solo》／《聖母峰》：登山電影的風險敘事與真實落差",
      "angle": "逐段指出電影拍得對的部分與被戲劇化的部分——她的紅線正好是『演出來的危險』，這個切角天然對上。",
      "pillar": "轉身時刻 Turning-Back Moments",
      "keywords": [
        "free solo",
        "徒手攀岩",
        "珠峰电影",
        "登山纪录片",
        "风险",
        "真实还原"
      ],
      "evergreen": true
    },
    {
      "id": "ro-news-everest-queue",
      "domain": "news",
      "title": "聖母峰塞車與商業登山事故新聞",
      "angle": "當期新聞一出就是她的主場：不評論死者，只講『這個天氣窗口下，隊伍該在幾點做什麼決定』。",
      "pillar": "轉身時刻 Turning-Back Moments",
      "keywords": [
        "珠峰堵车",
        "商业登山",
        "登山事故",
        "高山症",
        "天气窗口",
        "夏尔巴"
      ],
      "evergreen": false
    },
    {
      "id": "ro-pop-quit-culture",
      "domain": "pop",
      "title": "『轉身不是失敗』對上離職、放手與停損話題",
      "angle": "把登山術語（關門時間、天氣窗口、確保點）直接翻成職涯與感情裡的判斷——她單一最可轉譯的想法。",
      "pillar": "給平地人的山間道理 Mountain Wisdom for Flatlanders",
      "keywords": [
        "离职",
        "放弃",
        "止损",
        "内耗",
        "边界感",
        "转身",
        "允许自己休息"
      ],
      "evergreen": true
    },
    {
      "id": "ro-music-slowfolk",
      "domain": "music",
      "title": "環境音與慢節奏民謠：深夜筆記本的聲音",
      "angle": "以風聲、帳篷布聲、頭燈開關聲當主音軌，音樂只當底噪——符合她『環境音與人聲帶節奏』的剪輯規則。",
      "pillar": "深夜筆記本 & 山下的人 Midnight Notebook / People off the Mountain",
      "keywords": [
        "环境音",
        "白噪音",
        "民谣",
        "深夜",
        "helpsleep",
        "ambient"
      ],
      "evergreen": true
    }
  ],
  "redlines": [
    {
      "rule": "任何要求她說『這絕對安全』或誇大確定性的合作。",
      "keywords": [
        "绝对安全",
        "零风险",
        "保证成功",
        "百分百"
      ],
      "severity": "block"
    },
    {
      "rule": "為互動率擺拍危險動作或誇大難度。",
      "keywords": [
        "作死",
        "极限挑战",
        "无保护",
        "刺激",
        "搏命"
      ],
      "severity": "block"
    },
    {
      "rule": "美化、省略或包裝她 27 歲那次真實事故，把她塑造成零失誤傳奇。",
      "keywords": [
        "零事故",
        "传奇向导",
        "从未失手",
        "完美纪录"
      ],
      "severity": "block"
    },
    {
      "rule": "把感情狀態寫成已完結的劇情線，而非誠實、未解的成長線。",
      "keywords": [
        "脱单",
        "官宣",
        "恋情",
        "情感剧本"
      ],
      "severity": "warn"
    }
  ],
  "reach": {
    "regions": [
      "SG",
      "MY",
      "TW",
      "CN",
      "GLOBAL"
    ],
    "language": "zh-Hans"
  }
}
